,currentPage,numberOfPages,totalResults,data,status
47,3,6,273,"{'id': 'NaHVH0', 'name': 'Mild', 'nameDisplay': 'Mild', 'description': 'Nice body and flavor for a beer with not much alcohol content.', 'abv': '3.5', 'styleId': 10, 'isOrganic': 'N', 'status': 'verified', 'statusDisplay': 'Verified', 'createDate': '2013-07-27 13:27:50', 'updateDate': '2015-04-29 20:07:01', 'style': {'id': 10, 'categoryId': 1, 'category': {'id': 1, 'name': 'British Origin Ales', 'createDate': '2012-03-21 20:06:45'}, 'name': 'English-Style Pale Mild Ale', 'shortName': 'English Pale Mild', 'description': 'English pale mild ales range from golden to amber in color. Malt flavor dominates the flavor profile with little hop bitterness or flavor. Hop aroma can be light. Very low diacetyl flavors may be appropriate in this low-alcohol beer. Fruity-ester level is very low. Chill haze is allowable at cold temperatures.', 'ibuMin': '10', 'ibuMax': '20', 'abvMin': '3.2', 'abvMax': '4', 'srmMin': '8', 'srmMax': '17', 'ogMin': '1.03', 'fgMin': '1.004', 'fgMax': '1.008', 'createDate': '2012-03-21 20:06:45', 'updateDate': '2015-04-07 15:20:35'}}",success
48,3,6,273,"{'id': '8HYia1', 'name': 'Mild Child', 'nameDisplay': 'Mild Child', 'description': 'Mild Child is a collaboration with friend and former employee, Matt Tarpey, now of the Alchemist. It is our funkadelic version of a traditional English Mild aggressively infused with several different hops. With a low ABV of only 3.5%, it is light in body but heavy in hop.', 'abv': '3.5', 'ibu': '80', 'availableId': 2, 'styleId': 32, 'isOrganic': 'N', 'status': 'verified', 'statusDisplay': 'Verified', 'createDate': '2014-07-04 13:19:04', 'updateDate': '2014-07-04 13:19:04', 'available': {'id': 2, 'name': 'Limited', 'description': 'Limited availability.'}, 'style': {'id': 32, 'categoryId': 3, 'category': {'id': 3, 'name': 'North American Origin Ales', 'createDate': '2012-03-21 20:06:45'}, 'name': 'American-Style Amber/Red Ale', 'shortName': 'Amber', 'description': 'American amber/red ales range from light copper to light brown in color. They are characterized by American-variety hops used to produce the perception of medium hop bitterness, flavor, and medium aroma. Amber ales have medium-high to high maltiness with medium to low caramel character. They should have medium to medium-high body. The style may have low levels of fruityester flavor and aroma. Diacetyl can be either absent or barely perceived at very low levels. Chill haze is allowable at cold temperatures. Slight yeast haze is acceptable for bottle-conditioned products.', 'ibuMin': '30', 'ibuMax': '40', 'abvMin': '4.5', 'abvMax': '6', 'srmMin': '11', 'srmMax': '18', 'ogMin': '1.048', 'fgMin': '1.012', 'fgMax': '1.018', 'createDate': '2012-03-21 20:06:45', 'updateDate': '2015-04-07 15:26:52'}}",success
49,3,6,273,"{'id': '6QoaLw', 'name': 'Modelo Chelada', 'nameDisplay': 'Modelo Chelada', 'description': 'Chelada with the refreshing flavor of tomato, salt and lime', 'abv': '3.5', 'styleId': 124, 'isOrganic': 'N', 'status': 'verified', 'statusDisplay': 'Verified', 'createDate': '2014-08-04 20:03:25', 'updateDate': '2017-03-06 16:21:28', 'style': {'id': 124, 'categoryId': 11, 'category': {'id': 11, 'name': 'Hybrid/mixed Beer', 'createDate': '2012-03-21 20:06:46'}, 'name': 'Herb and Spice Beer', 'shortName': 'Spice Beer', 'description': 'Herb beers use herbs or spices (derived from roots, seeds, fruits, vegetable, flowers, etc.) other than or in addition to hops to create a distinct (ranging from subtle to intense) character, though individual characters of herbs and/or spices used may not always be identifiable. Under hopping often, but not always, allows the spice or herb to contribute to the flavor profile. Positive evaluations are significantly based on perceived balance of flavors. Note: Chili-flavored beers that emphasize heat rather than chili flavor should be entered as a ""spiced"" beer.  A statement by the brewer explaining what herbs or spices are used is essential in order for fair assessment in competitions. Specifying a style upon which the beer is based may help evaluation. If this beer is a classic style with an herb or spice, the brewer should specify the classic style. If no Chocolate or Coffee category exists in a competition, then chocolate and coffee beers should be entered in this category.', 'ibuMin': '5', 'ibuMax': '70', 'abvMin': '2.5', 'abvMax': '12', 'srmMin': '5', 'srmMax': '50', 'ogMin': '1.03', 'fgMin': '1.006', 'fgMax': '1.03', 'createDate': '2012-03-21 20:06:46', 'updateDate': '2015-04-07 15:44:45'}}",success
0,4,6,273,"{'id': 'rjVOKm', 'name': 'Money,  Cash, Gose', 'nameDisplay': 'Money,  Cash, Gose', 'description': 'Money, Cash, Gose, is an unfiltered German style wheat ale with a salty, tart, and refreshing mouthfeel.', 'abv': '3.5', 'ibu': '4', 'styleId': 165, 'isOrganic': 'N', 'status': 'verified', 'statusDisplay': 'Verified', 'createDate': '2017-02-26 12:24:51', 'updateDate': '2017-02-26 12:24:51', 'style': {'id': 165, 'categoryId': 1, 'category': {'id': 1, 'name': 'British Origin Ales', 'createDate': '2012-03-21 20:06:45'}, 'name': 'Contemporary Gose', 'shortName': 'Contemporary Gose', 'description': 'Contemporary Goses are straw to medium amber, or, may take on the hue of added fruits or other ingredients if present. Appearance is cloudy/hazy with yeast character, and may have evidence of continued fermentation activity. A wide variety of herbal, spice, floral or fruity aromas other than found in traditional Leipzig-Style Gose are present, in harmony with other aromas. Horsey, leathery or earthy aromas contributed by Brettanomyces yeasts may be evident but have a very low profile, as this beer is not excessively aged. Hop aroma is not perceived. Malt sweetness is not perceived to very low. They typically contain malted barley and unmalted wheat, with some traditional varieties containing oats. Hop flavor is not perceived. Hop bitterness is not perceived. A wide variety of herbal, spice, floral or fruity flavors other than found in traditional Leipzig-Style Gose, are present in harmony with the overall flavor profile. Salt (table salt) character is traditional in low amounts, but may vary from absent to present in Contemporary Gose. Horsey, leathery or earthy flavors contributed by Brettanomyces yeasts may be evident but have a very low profile, as this beer is not excessively aged. Contemporary Gose may be fermented with pure beer yeast strains, or with yeast mixed with bacteria. Contemporary Gose may be spontaneously fermented, similarly to Belgian-style gueuze/lambic beers, and should exhibit complexity of acidic, flavor and aroma contributed by introduction of wild yeast and bacteria into the fermentation. Low to medium lactic acid character is evident in all examples as sharp, refreshing sourness. A primary difference between Belgian Gueuze and Gose is that Gose is served at a much younger age. Gose is typically enjoyed fresh and carbonated. Overall complexity of flavors and aromas sought while maintaining a balance between acidity, yeast-enhanced spice and refreshment is ideal. Body is low to medium-low.', 'createDate': '2015-04-07 17:10:42'}}",success
1,4,6,273,"{'id': '7gZ3b4', 'name': 'Mouthy Muskie Light', 'nameDisplay': 'Mouthy Muskie Light', 'description': 'A clean low carb and low calorie ale (3.4 carbs, 96 cal.) Brewed with light colored malt and flaked rice. It has a light malt flavor. Hop bitterness and aroma is low and comes from Sazz hops.', 'abv': '3.5', 'ibu': '17', 'availableId': 1, 'styleId': 94, 'isOrganic': 'N', 'labels': {'icon': 'https://s3.amazonaws.com/brewerydbapi/beer/7gZ3b4/upload_PfFu7e-icon.png', 'medium': 'https://s3.amazonaws.com/brewerydbapi/beer/7gZ3b4/upload_PfFu7e-medium.png', 'large': 'https://s3.amazonaws.com/brewerydbapi/beer/7gZ3b4/upload_PfFu7e-large.png'}, 'status': 'verified', 'statusDisplay': 'Verified', 'createDate': '2015-04-14 19:46:33', 'updateDate': '2015-12-18 00:56:07', 'available': {'id': 1, 'name': 'Year Round', 'description': 'Available year round as a staple beer.'}, 'style': {'id': 94, 'categoryId': 8, 'category': {'id': 8, 'name': 'North American Lager', 'createDate': '2012-03-21 20:06:46'}, 'name': 'American-Style Light (Low Calorie) Lager', 'shortName': 'American Light Lager', 'description': 'These beers are extremely light colored, light in body, and high in carbonation. Calorie level should not exceed 125 per 12 ounce serving. Corn, rice, or other grain or sugar adjuncts are often used. Flavor is mild and hop bitterness and aroma is negligible to very low. Light fruity esters are acceptable. Chill haze and diacetyl should be absent.', 'ibuMin': '5', 'ibuMax': '10', 'abvMin': '3.5', 'abvMax': '4.4', 'srmMin': '2', 'srmMax': '4', 'ogMin': '1.024', 'fgMin': '1.002', 'fgMax': '1.008', 'createDate': '2012-03-21 20:06:46', 'updateDate': '2015-04-07 15:39:35'}}",success
2,4,6,273,"{'id': 'AHYcDZ', 'name': 'Mr. Sparkle', 'nameDisplay': 'Mr. Sparkle', 'description': 'A joint venture of Metsumura Fishworks & Tamaribuchi Heavy Manufacturing Concern.', 'abv': '3.5', 'styleId': 72, 'isOrganic': 'N', 'status': 'verified', 'statusDisplay': 'Verified', 'createDate': '2017-02-02 14:40:01', 'updateDate': '2017-02-02 14:40:01', 'style': {'id': 72, 'categoryId': 5, 'category': {'id': 5, 'name': 'Belgian And French Origin Ales', 'createDate': '2012-03-21 20:06:46'}, 'name': 'French & Belgian-Style Saison', 'shortName': 'Saison', 'description': 'Beers in this category are golden to deep amber in color. There may be quite a variety of characters within this style. Generally: They are light to medium in body. Malt aroma is low to medium-low. Esters are medium to high in  aroma, while, complex alcohols, herbs, spices, low Brettanomyces character and even clove and smoke-like phenolics may or may not be evident in the overall balanced beer. Hop aroma and flavor may be at low to medium levels. Malt flavor is low but provides foundation for the overall balance. Hop bitterness is moderate to moderately assertive. Herb and/or spice flavors, including black pepper-like notes, may or may not be evident. Fruitiness from fermentation is generally in character. A balanced small amount of sour or acidic flavors is acceptable when in balance with other components. Earthy, cellar-like, musty aromas are okay. Diacetyl should not be perceived. Chill or slight yeast haze is okay. Often bottle conditioned with some yeast character and high carbonation. French & Belgian-Style Saison may have Brettanomyces characters that are slightly acidity, fruity, horsey, goaty and/or leather-like.', 'ibuMin': '20', 'ibuMax': '40', 'abvMin': '4.5', 'abvMax': '8.5', 'srmMin': '4', 'srmMax': '14', 'ogMin': '1.055', 'fgMin': '1.004', 'fgMax': '1.016', 'createDate': '2012-03-21 20:06:46', 'updateDate': '2015-04-07 15:34:55'}}",success
3,4,6,273,"{'id': 'qaVDKC', 'name': 'Munich Helles', 'nameDisplay': 'Munich Helles', 'abv': '3.5', 'ibu': '20', 'styleId': 78, 'isOrganic': 'N', 'status': 'verified', 'statusDisplay': 'Verified', 'createDate': '2012-01-03 02:43:44', 'updateDate': '2015-09-03 19:08:07', 'style': {'id': 78, 'categoryId': 7, 'category': {'id': 7, 'name': 'European-germanic Lager', 'createDate': '2012-03-21 20:06:46'}, 'name': 'Münchner (Munich)-Style Helles', 'shortName': 'Helles', 'description': 'This beer should be perceived as having low bitterness. It is a medium-bodied, malt-emphasized beer with malt character often balanced with low levels of yeast produced sulfur compounds (character). Certain renditions of this beer style have  a perceivable level of hop flavor (note: hop flavor does not imply hop bitterness) and character but it is essentially balanced with malt character to retain its style identity. Malt character is sometimes bread-like yet always reminiscent of freshly and very lightly toasted malted barley. There should not be any caramel character. Color is light straw to golden. Fruity esters and diacetyl should not be perceived. There should be no chill haze.', 'ibuMin': '18', 'ibuMax': '25', 'abvMin': '4.5', 'abvMax': '5.5', 'srmMin': '4', 'srmMax': '6', 'ogMin': '1.044', 'fgMin': '1.008', 'fgMax': '1.012', 'createDate': '2012-03-21 20:06:46', 'updateDate': '2015-04-07 15:36:40'}}",success
4,4,6,273,"{'id': 'tMeOgO', 'name': 'Myshka', 'nameDisplay': 'Myshka', 'description': 'Russian Style Serf Stout - a very low alcohol Russian Style Imperial Stout', 'abv': '3.5', 'ibu': '25', 'styleId': 44, 'isOrganic': 'N', 'status': 'verified', 'statusDisplay': 'Verified', 'createDate': '2017-02-28 20:39:04', 'updateDate': '2017-02-28 20:39:04', 'style': {'id': 44, 'categoryId': 3, 'category': {'id': 3, 'name': 'North American Origin Ales', 'createDate': '2012-03-21 20:06:45'}, 'name': 'Specialty Stouts', 'shortName': 'Stout', 'description': 'See British Origin American-Style Imperial Porter Imperial porters are very dark brown to black in color. No roast barley or strong burnt/astringent black malt character should be perceived. Medium malt, caramel and cocoa-like sweetness should be in harmony with medium-low to medium hop bitterness. This is a full bodied beer. Ale-like fruity esters should be evident but not overpowering and compliment malt derived sweetness and hop character. Hop flavor and aroma may vary from being low to medium-high. Diacetyl (butterscotch) levels should be absent.', 'ibuMin': '35', 'ibuMax': '50', 'abvMin': '7', 'abvMax': '12', 'srmMin': '40', 'srmMax': '40', 'ogMin': '1.08', 'fgMin': '1.02', 'fgMax': '1.03', 'createDate': '2012-03-21 20:06:46', 'updateDate': '2015-04-07 15:28:58'}}",success
5,4,6,273,"{'id': 'DmhQtZ', 'name': 'Mystic Cherry', 'nameDisplay': 'Mystic Cherry', 'description': 'It smells fresh and tasty and has the full flavour of summer cherries combined with wheat beer. Mystic lets you enjoy the taste of cherries all year round.\r\n \r\nContains 25% cherry juice. Does not contain preservatives.', 'abv': '3.5', 'glasswareId': 10, 'availableId': 1, 'styleId': 119, 'isOrganic': 'N', 'status': 'verified', 'statusDisplay': 'Verified', 'createDate': '2012-11-02 14:45:17', 'updateDate': '2012-11-03 16:05:13', 'glass': {'id': 10, 'name': 'Oversized Wine Glass', 'createDate': '2012-01-03 02:41:33'}, 'available': {'id': 1, 'name': 'Year Round', 'description': 'Available year round as a staple beer.'}, 'style': {'id': 119, 'categoryId': 11, 'category': {'id': 11, 'name': 'Hybrid/mixed Beer', 'createDate': '2012-03-21 20:06:46'}, 'name': 'Fruit Beer', 'shortName': 'Fruit Beer', 'description': 'Fruit beers are any beers using fruit or fruit extracts as an adjunct in either, the mash, kettle, primary or secondary fermentation providing obvious (ranging from subtle to intense), yet harmonious, fruit qualities. Fruit qualities should not be overpowered by hop character. If a fruit (such as juniper berry) has an herbal or spice quality, it is more appropriate to consider it in the herb and spice beers category. Acidic bacterial (not wild yeast) fermentation characters may be evident (but not necessary) they would contribute to acidity and enhance fruity balance. Clear or hazy beer is acceptable in appearance. A statement by the brewer explaining what fruits are used is essential in order for fair assessment in competitions. If this beer is a classic style with fruit, the brewer should also specify the classic style.', 'ibuMin': '5', 'ibuMax': '70', 'abvMin': '2.5', 'abvMax': '12', 'srmMin': '5', 'srmMax': '50', 'ogMin': '1.03', 'fgMin': '1.006', 'fgMax': '1.03', 'createDate': '2012-03-21 20:06:46', 'updateDate': '2015-04-07 15:44:21'}}",success
6,4,6,273,"{'id': 'exkC4n', 'name': 'Naftali', 'nameDisplay': 'Naftali', 'description': 'Norsk Sour Oatmeal Milk Farmhouse Hoppy Ale 10 Blg, 3,5% ABV Sour ale with Voss Kveik yeast, lactose and flaked oats, dry-hopped with Citra hops. pH 2,7', 'abv': '3.5', 'styleId': 40, 'isOrganic': 'N', 'status': 'verified', 'statusDisplay': 'Verified', 'createDate': '2017-11-09 19:53:08', 'updateDate': '2017-11-09 19:53:08', 'style': {'id': 40, 'categoryId': 3, 'category': {'id': 3, 'name': 'North American Origin Ales', 'createDate': '2012-03-21 20:06:45'}, 'name': 'American-Style Sour Ale', 'shortName': 'Sour', 'description': 'American sour ales can be very light to black or take on the color of added fruits or other ingredients. There is no Brettanomyces character in this style of beer. Wood- and barrel-aged sour ales are classified elsewhere. If acidity is present it is usually in the form of lactic, acetic and other organic acids naturally developed with acidified malt in the mash or in fermentation by the use of various microorganisms including certain bacteria and yeasts. Acidic character can be a complex balance of several types of acid and characteristics of age. The evolution of natural acidity develops balanced complexity. Residual flavors that come from liquids previously aged in a barrel such as bourbon or sherry should not be present. Wood vessels may be used during the fermentation and aging process, but wood-derived flavors such as vanillin must not be present. In darker versions, roasted malt, caramel-like and chocolate-like characters should be subtle in both flavor and aroma. American sour may have evident full range of hop aroma and hop bitterness with a full range of body. Estery and fruity-ester characters are evident, sometimes moderate and sometimes intense, yet balanced. Diacetyl and sweet corn-like dimethylsulfide (DMS) should not be perceived. Chill haze, bacteria and yeast-induced haze are allowable at low to medium levels at any temperature. Fruited American-Style Sour Ales will exhibit fruit flavors in harmonious balance with other characters.', 'createDate': '2012-03-21 20:06:46', 'updateDate': '2015-04-07 15:28:32'}}",success
7,4,6,273,"{'id': 'tYdlpW', 'name': 'Newton', 'nameDisplay': 'Newton', 'description': 'What mixture could be more successful than that between an apple and a white beer? Lefèbvre brewery is situated in the midst of splendid orchards and was therefore expected to come up with a fresh and refreshing product. This became a mixture of a top quality white beer and the juice from apples from the orchard. Thus an original drink was born which leaves no one indifferent.\r\nDrinking under an apple tree is allowed...as long as it is a really refreshing experience.', 'abv': '3.5', 'glasswareId': 1, 'availableId': 1, 'styleId': 119, 'isOrganic': 'N', 'labels': {'icon': 'https://s3.amazonaws.com/brewerydbapi/beer/tYdlpW/upload_dXCzfT-icon.png', 'medium': 'https://s3.amazonaws.com/brewerydbapi/beer/tYdlpW/upload_dXCzfT-medium.png', 'large': 'https://s3.amazonaws.com/brewerydbapi/beer/tYdlpW/upload_dXCzfT-large.png'}, 'status': 'verified', 'statusDisplay': 'Verified', 'createDate': '2012-11-02 12:28:13', 'updateDate': '2015-12-16 19:22:45', 'glass': {'id': 1, 'name': 'Flute', 'createDate': '2012-01-03 02:41:33'}, 'available': {'id': 1, 'name': 'Year Round', 'description': 'Available year round as a staple beer.'}, 'style': {'id': 119, 'categoryId': 11, 'category': {'id': 11, 'name': 'Hybrid/mixed Beer', 'createDate': '2012-03-21 20:06:46'}, 'name': 'Fruit Beer', 'shortName': 'Fruit Beer', 'description': 'Fruit beers are any beers using fruit or fruit extracts as an adjunct in either, the mash, kettle, primary or secondary fermentation providing obvious (ranging from subtle to intense), yet harmonious, fruit qualities. Fruit qualities should not be overpowered by hop character. If a fruit (such as juniper berry) has an herbal or spice quality, it is more appropriate to consider it in the herb and spice beers category. Acidic bacterial (not wild yeast) fermentation characters may be evident (but not necessary) they would contribute to acidity and enhance fruity balance. Clear or hazy beer is acceptable in appearance. A statement by the brewer explaining what fruits are used is essential in order for fair assessment in competitions. If this beer is a classic style with fruit, the brewer should also specify the classic style.', 'ibuMin': '5', 'ibuMax': '70', 'abvMin': '2.5', 'abvMax': '12', 'srmMin': '5', 'srmMax': '50', 'ogMin': '1.03', 'fgMin': '1.006', 'fgMax': '1.03', 'createDate': '2012-03-21 20:06:46', 'updateDate': '2015-04-07 15:44:21'}}",success
8,4,6,273,"{'id': 'sCLyCH', 'name': 'Nothing To Declare', 'nameDisplay': 'Nothing To Declare', 'description': 'We brewed a special Berliner with our dudes from Kex Brewing in Iceland. Nothing to Declare is a Berliner Weisse with raspberries and stone bramble berries. Stone bramble berries are native Icelandic berries know to be sour and a little tannic. This beer is slightly tart, bright and light.', 'abv': '3.5', 'styleId': 46, 'isOrganic': 'N', 'status': 'verified', 'statusDisplay': 'Verified', 'createDate': '2018-03-08 19:25:48', 'updateDate': '2018-03-08 19:26:35', 'style': {'id': 46, 'categoryId': 4, 'category': {'id': 4, 'name': 'German Origin Ales', 'createDate': '2012-03-21 20:06:46'}, 'name': 'Berliner-Style Weisse (Wheat)', 'shortName': 'Berlinerweisse', 'description': 'This is very pale in color and the lightest of all the German wheat beers. The unique combination of yeast and lactic acid bacteria fermentation yields a beer that is acidic, highly attenuated, and very light bodied. The carbonation of a Berliner Weisse is high, and hop rates are very low. Clarity may be hazy or cloudy from yeast or chill haze. Hop character should not be perceived. Fruity esters will be evident. No diacetyl should be perceived.', 'ibuMin': '3', 'ibuMax': '6', 'abvMin': '2.8', 'abvMax': '3.4', 'srmMin': '2', 'srmMax': '4', 'ogMin': '1.028', 'fgMin': '1.004', 'fgMax': '1.006', 'createDate': '2012-03-21 20:06:46', 'updateDate': '2015-04-07 15:29:14'}}",success
9,4,6,273,"{'id': 'd21nqP', 'name': 'Obey Your Thirst', 'nameDisplay': 'Obey Your Thirst', 'description': 'Floridaweisse made with lemon and lime.', 'abv': '3.5', 'glasswareId': 8, 'styleId': 46, 'isOrganic': 'N', 'status': 'verified', 'statusDisplay': 'Verified', 'servingTemperature': 'cold', 'servingTemperatureDisplay': 'Cold - (4-7C/39-45F)', 'createDate': '2015-07-08 13:24:16', 'updateDate': '2015-07-08 13:27:06', 'glass': {'id': 8, 'name': 'Tulip', 'createDate': '2012-01-03 02:41:33'}, 'style': {'id': 46, 'categoryId': 4, 'category': {'id': 4, 'name': 'German Origin Ales', 'createDate': '2012-03-21 20:06:46'}, 'name': 'Berliner-Style Weisse (Wheat)', 'shortName': 'Berlinerweisse', 'description': 'This is very pale in color and the lightest of all the German wheat beers. The unique combination of yeast and lactic acid bacteria fermentation yields a beer that is acidic, highly attenuated, and very light bodied. The carbonation of a Berliner Weisse is high, and hop rates are very low. Clarity may be hazy or cloudy from yeast or chill haze. Hop character should not be perceived. Fruity esters will be evident. No diacetyl should be perceived.', 'ibuMin': '3', 'ibuMax': '6', 'abvMin': '2.8', 'abvMax': '3.4', 'srmMin': '2', 'srmMax': '4', 'ogMin': '1.028', 'fgMin': '1.004', 'fgMax': '1.006', 'createDate': '2012-03-21 20:06:46', 'updateDate': '2015-04-07 15:29:14'}}",success
10,4,6,273,"{'id': 'ogr4tF', 'name': 'Ojos Locos', 'nameDisplay': 'Ojos Locos', 'abv': '3.5', 'glasswareId': 5, 'availableId': 1, 'styleId': 138, 'isOrganic': 'N', 'status': 'verified', 'statusDisplay': 'Verified', 'createDate': '2014-10-01 14:43:00', 'updateDate': '2014-10-01 15:24:36', 'glass': {'id': 5, 'name': 'Pint', 'createDate': '2012-01-03 02:41:33'}, 'available': {'id': 1, 'name': 'Year Round', 'description': 'Available year round as a staple beer.'}, 'style': {'id': 138, 'categoryId': 11, 'category': {'id': 11, 'name': 'Hybrid/mixed Beer', 'createDate': '2012-03-21 20:06:46'}, 'name': 'Other Strong Ale or Lager', 'shortName': 'Strong Ale', 'description': ""Any style of beer can be made stronger than the classic style guidelines. The goal should be to reach a balance between the style's character and the additional alcohol. Refer to this guide when making styles stronger and appropriately identify the style created (for example: double alt, triple fest, or quadruple Pilsener)."", 'createDate': '2012-03-21 20:06:46', 'updateDate': '2015-04-07 15:47:08'}}",success
11,4,6,273,"{'id': 'PtN8vG', 'name': 'Opening Day Berliner', 'nameDisplay': 'Opening Day Berliner', 'abv': '3.5', 'styleId': 46, 'isOrganic': 'N', 'status': 'verified', 'statusDisplay': 'Verified', 'createDate': '2015-10-14 15:35:34', 'updateDate': '2015-10-14 15:35:34', 'style': {'id': 46, 'categoryId': 4, 'category': {'id': 4, 'name': 'German Origin Ales', 'createDate': '2012-03-21 20:06:46'}, 'name': 'Berliner-Style Weisse (Wheat)', 'shortName': 'Berlinerweisse', 'description': 'This is very pale in color and the lightest of all the German wheat beers. The unique combination of yeast and lactic acid bacteria fermentation yields a beer that is acidic, highly attenuated, and very light bodied. The carbonation of a Berliner Weisse is high, and hop rates are very low. Clarity may be hazy or cloudy from yeast or chill haze. Hop character should not be perceived. Fruity esters will be evident. No diacetyl should be perceived.', 'ibuMin': '3', 'ibuMax': '6', 'abvMin': '2.8', 'abvMax': '3.4', 'srmMin': '2', 'srmMax': '4', 'ogMin': '1.028', 'fgMin': '1.004', 'fgMax': '1.006', 'createDate': '2012-03-21 20:06:46', 'updateDate': '2015-04-07 15:29:14'}}",success
