,currentPage,numberOfPages,totalResults,data,status
35,2,6,273,"{'id': 'bXem9Y', 'name': 'Drachenfutter', 'nameDisplay': 'Drachenfutter', 'description': '“A gift which men give to their wives or girlfriends to say sorry.” Drachenfutter is a very pale and mildly sour wheat ale, with lactobacillus and saccharomyces. This sessionable brew is our favorite for warm weather and patio season.', 'abv': '3.5', 'ibu': '8', 'styleId': 40, 'isOrganic': 'N', 'labels': {'icon': 'https://s3.amazonaws.com/brewerydbapi/beer/bXem9Y/upload_52vwnL-icon.png', 'medium': 'https://s3.amazonaws.com/brewerydbapi/beer/bXem9Y/upload_52vwnL-medium.png', 'large': 'https://s3.amazonaws.com/brewerydbapi/beer/bXem9Y/upload_52vwnL-large.png'}, 'status': 'verified', 'statusDisplay': 'Verified', 'createDate': '2018-08-13 12:58:06', 'updateDate': '2018-08-13 12:59:11', 'style': {'id': 40, 'categoryId': 3, 'category': {'id': 3, 'name': 'North American Origin Ales', 'createDate': '2012-03-21 20:06:45'}, 'name': 'American-Style Sour Ale', 'shortName': 'Sour', 'description': 'American sour ales can be very light to black or take on the color of added fruits or other ingredients. There is no Brettanomyces character in this style of beer. Wood- and barrel-aged sour ales are classified elsewhere. If acidity is present it is usually in the form of lactic, acetic and other organic acids naturally developed with acidified malt in the mash or in fermentation by the use of various microorganisms including certain bacteria and yeasts. Acidic character can be a complex balance of several types of acid and characteristics of age. The evolution of natural acidity develops balanced complexity. Residual flavors that come from liquids previously aged in a barrel such as bourbon or sherry should not be present. Wood vessels may be used during the fermentation and aging process, but wood-derived flavors such as vanillin must not be present. In darker versions, roasted malt, caramel-like and chocolate-like characters should be subtle in both flavor and aroma. American sour may have evident full range of hop aroma and hop bitterness with a full range of body. Estery and fruity-ester characters are evident, sometimes moderate and sometimes intense, yet balanced. Diacetyl and sweet corn-like dimethylsulfide (DMS) should not be perceived. Chill haze, bacteria and yeast-induced haze are allowable at low to medium levels at any temperature. Fruited American-Style Sour Ales will exhibit fruit flavors in harmonious balance with other characters.', 'createDate': '2012-03-21 20:06:46', 'updateDate': '2015-04-07 15:28:32'}}",success
36,2,6,273,"{'id': 'ZEIJb1', 'name': 'Dragon Fruit Passion Fruit Berliner', 'nameDisplay': 'Dragon Fruit Passion Fruit Berliner', 'abv': '3.5', 'styleId': 46, 'isOrganic': 'N', 'status': 'verified', 'statusDisplay': 'Verified', 'createDate': '2018-05-10 20:04:33', 'updateDate': '2018-06-21 18:43:40', 'style': {'id': 46, 'categoryId': 4, 'category': {'id': 4, 'name': 'German Origin Ales', 'createDate': '2012-03-21 20:06:46'}, 'name': 'Berliner-Style Weisse (Wheat)', 'shortName': 'Berlinerweisse', 'description': 'This is very pale in color and the lightest of all the German wheat beers. The unique combination of yeast and lactic acid bacteria fermentation yields a beer that is acidic, highly attenuated, and very light bodied. The carbonation of a Berliner Weisse is high, and hop rates are very low. Clarity may be hazy or cloudy from yeast or chill haze. Hop character should not be perceived. Fruity esters will be evident. No diacetyl should be perceived.', 'ibuMin': '3', 'ibuMax': '6', 'abvMin': '2.8', 'abvMax': '3.4', 'srmMin': '2', 'srmMax': '4', 'ogMin': '1.028', 'fgMin': '1.004', 'fgMax': '1.006', 'createDate': '2012-03-21 20:06:46', 'updateDate': '2015-04-07 15:29:14'}}",success
37,2,6,273,"{'id': 'ruTKue', 'name': 'D’Brücke', 'nameDisplay': 'D’Brücke', 'description': 'Light, tart, with a crisp finish.', 'abv': '3.5', 'availableId': 4, 'styleId': 46, 'isOrganic': 'N', 'status': 'verified', 'statusDisplay': 'Verified', 'createDate': '2017-07-17 20:34:44', 'updateDate': '2017-07-18 13:30:14', 'available': {'id': 4, 'name': 'Seasonal', 'description': 'Available at the same time of year, every year.'}, 'style': {'id': 46, 'categoryId': 4, 'category': {'id': 4, 'name': 'German Origin Ales', 'createDate': '2012-03-21 20:06:46'}, 'name': 'Berliner-Style Weisse (Wheat)', 'shortName': 'Berlinerweisse', 'description': 'This is very pale in color and the lightest of all the German wheat beers. The unique combination of yeast and lactic acid bacteria fermentation yields a beer that is acidic, highly attenuated, and very light bodied. The carbonation of a Berliner Weisse is high, and hop rates are very low. Clarity may be hazy or cloudy from yeast or chill haze. Hop character should not be perceived. Fruity esters will be evident. No diacetyl should be perceived.', 'ibuMin': '3', 'ibuMax': '6', 'abvMin': '2.8', 'abvMax': '3.4', 'srmMin': '2', 'srmMax': '4', 'ogMin': '1.028', 'fgMin': '1.004', 'fgMax': '1.006', 'createDate': '2012-03-21 20:06:46', 'updateDate': '2015-04-07 15:29:14'}}",success
38,2,6,273,"{'id': 'Olhtjk', 'name': 'English Mild #5', 'nameDisplay': 'English Mild #5', 'description': 'Contains a good, full malt flavor while still being incredibly drinkable.', 'abv': '3.5', 'availableId': 2, 'styleId': 11, 'isOrganic': 'N', 'status': 'verified', 'statusDisplay': 'Verified', 'createDate': '2016-06-21 20:43:00', 'updateDate': '2016-06-29 20:12:47', 'available': {'id': 2, 'name': 'Limited', 'description': 'Limited availability.'}, 'style': {'id': 11, 'categoryId': 1, 'category': {'id': 1, 'name': 'British Origin Ales', 'createDate': '2012-03-21 20:06:45'}, 'name': 'English-Style Dark Mild Ale', 'shortName': 'English Dark Mild', 'description': 'English dark mild ales range from deep copper to dark brown (often with a red tint) in color. Malt flavor and caramel are part of the flavor and aroma profile while, licorice and roast malt tones may sometimes contribute to the flavor and aroma profile. Body should be low-medium to medium. These beers have very little hop flavor or aroma. Very low diacetyl flavors may be appropriate in this low-alcohol beer. Fruity-ester level is very low.', 'ibuMin': '10', 'ibuMax': '24', 'abvMin': '3.2', 'abvMax': '4', 'srmMin': '17', 'srmMax': '34', 'ogMin': '1.03', 'fgMin': '1.004', 'fgMax': '1.008', 'createDate': '2012-03-21 20:06:45', 'updateDate': '2015-04-07 15:20:43'}}",success
39,2,6,273,"{'id': 'k8PfBL', 'name': 'Farnam House Gratzer', 'nameDisplay': 'Farnam House Gratzer', 'description': 'A traditional Polish smoked wheat beer.  Light and slightly tart, this smoked beer is approachable and refreshing without the heaviness of many smoked beers.', 'abv': '3.5', 'ibu': '20', 'glasswareId': 8, 'srmId': 4, 'styleId': 160, 'isOrganic': 'N', 'status': 'verified', 'statusDisplay': 'Verified', 'createDate': '2014-09-11 16:53:03', 'updateDate': '2014-09-11 18:45:11', 'glass': {'id': 8, 'name': 'Tulip', 'createDate': '2012-01-03 02:41:33'}, 'srm': {'id': 4, 'name': '4', 'hex': 'FFBF42'}, 'style': {'id': 160, 'categoryId': 13, 'category': {'id': 13, 'name': 'Other Origin', 'createDate': '2013-08-10 12:44:20'}, 'name': 'Grodziskie', 'shortName': 'Grodziskie', 'description': 'Grodziskies are straw to golden colored. Chill haze is allowable at cold temperatures. Aroma is dominated by oak smoke notes. Fruity-ester aroma can be low. Diacetyl and DMS aromas should not be perceived. Hop aroma is not perceived to very low European noble hop aroma notes. Distinctive character comes from 100% oak wood smoked wheat malt. Overall balance is a sessionably medium to medium-high assertively oak-smoky malt emphasized beer. Hop flavor is very low to low European noble hop flavor notes. Hop bitterness is medium-low to medium clean hop bitterness. Ale fermentation temperatures are managed to lend a crisp overall flavor impression. Low fruity-ester flavor may be present. Sourness, diacetyl, and DMS should not be perceived on the palate. Grodziskie (also known as Grätzer) is a Polish ale style. Historic versions were most often bottle conditioned to relatively high carbonation levels. Body is low to medium low.', 'ibuMin': '15', 'ibuMax': '25', 'abvMin': '2.1', 'abvMax': '2.9', 'srmMin': '3', 'srmMax': '6', 'ogMin': '1.028', 'ogMax': '1.036', 'fgMin': '1.006', 'fgMax': '1.01', 'createDate': '2013-08-10 12:45:30', 'updateDate': '2015-04-07 17:11:41'}}",success
40,2,6,273,"{'id': 'hOlx04', 'name': 'Fire Catcher', 'nameDisplay': 'Fire Catcher', 'description': 'A dazzling 3.5% golden beer. The warming hints of honeyed nectar will spark the intense &amp; sharp gooseberry flames. A refreshingly crisp catch smouldering in a citrus aroma that will leave you glowing from inside.', 'abv': '3.5', 'availableId': 1, 'styleId': 36, 'isOrganic': 'N', 'labels': {'icon': 'https://s3.amazonaws.com/brewerydbapi/beer/hOlx04/upload_cp2rzI-icon.png', 'medium': 'https://s3.amazonaws.com/brewerydbapi/beer/hOlx04/upload_cp2rzI-medium.png', 'large': 'https://s3.amazonaws.com/brewerydbapi/beer/hOlx04/upload_cp2rzI-large.png'}, 'status': 'verified', 'statusDisplay': 'Verified', 'createDate': '2016-02-06 18:51:06', 'updateDate': '2016-03-08 18:20:15', 'available': {'id': 1, 'name': 'Year Round', 'description': 'Available year round as a staple beer.'}, 'style': {'id': 36, 'categoryId': 3, 'category': {'id': 3, 'name': 'North American Origin Ales', 'createDate': '2012-03-21 20:06:45'}, 'name': 'Golden or Blonde Ale', 'shortName': 'Blonde', 'description': 'Golden or Blonde ales are straw to golden blonde in color. They have a crisp, dry palate, light to medium body, and light malt sweetness. Low to medium hop aroma may be present but does not dominate. Bitterness is low to medium. Fruity esters may be perceived but do not predominate. Diacetyl should not be perceived. Chill haze should be absent.', 'ibuMin': '15', 'ibuMax': '25', 'abvMin': '4', 'abvMax': '5', 'srmMin': '3', 'srmMax': '7', 'ogMin': '1.045', 'fgMin': '1.008', 'fgMax': '1.016', 'createDate': '2012-03-21 20:06:46', 'updateDate': '2015-04-07 15:27:26'}}",success
41,2,6,273,"{'id': '3ccXrE', 'name': 'Fitzhugh Ale', 'nameDisplay': 'Fitzhugh Ale', 'description': 'As easy going as an afternoon at our ranch on Fitzhugh Road, the Fitzhugh Ale is a laidback sipper.\r\n\r\nIt’s made with a balance of 2-row, Carmel Wheat and toasted malts with just enough Mandarina Bavaria and East Kent Goldings hops to let the malt flavors shine through. The toasted bread, chocolate, coffee, orange, honey and lavender flavors pair well with a selection of charcuterie and cheese.', 'abv': '3.5', 'styleId': 10, 'isOrganic': 'N', 'status': 'verified', 'statusDisplay': 'Verified', 'createDate': '2017-06-25 16:15:36', 'updateDate': '2017-06-25 16:15:36', 'style': {'id': 10, 'categoryId': 1, 'category': {'id': 1, 'name': 'British Origin Ales', 'createDate': '2012-03-21 20:06:45'}, 'name': 'English-Style Pale Mild Ale', 'shortName': 'English Pale Mild', 'description': 'English pale mild ales range from golden to amber in color. Malt flavor dominates the flavor profile with little hop bitterness or flavor. Hop aroma can be light. Very low diacetyl flavors may be appropriate in this low-alcohol beer. Fruity-ester level is very low. Chill haze is allowable at cold temperatures.', 'ibuMin': '10', 'ibuMax': '20', 'abvMin': '3.2', 'abvMax': '4', 'srmMin': '8', 'srmMax': '17', 'ogMin': '1.03', 'fgMin': '1.004', 'fgMax': '1.008', 'createDate': '2012-03-21 20:06:45', 'updateDate': '2015-04-07 15:20:35'}}",success
42,2,6,273,"{'id': '9n4zw7', 'name': 'Flower Child', 'nameDisplay': 'Flower Child', 'description': 'Pipeworks Flower Child is the groovy, free-spirited sister to the previous generations of berliner beauties. Naked as the day she was born, this free loving girl is pure and unadultered. Take a taste and she’ll drop a tantalizingly tart acidity beside a refreshing wheat base. Simple yet so complex, this righteous girl promises a peak experience. Peace, love and Berliner Weisse. Can you dig it?', 'abv': '3.5', 'glasswareId': 6, 'availableId': 2, 'styleId': 46, 'isOrganic': 'N', 'labels': {'icon': 'https://s3.amazonaws.com/brewerydbapi/beer/9n4zw7/upload_0vgLuc-icon.png', 'medium': 'https://s3.amazonaws.com/brewerydbapi/beer/9n4zw7/upload_0vgLuc-medium.png', 'large': 'https://s3.amazonaws.com/brewerydbapi/beer/9n4zw7/upload_0vgLuc-large.png'}, 'status': 'verified', 'statusDisplay': 'Verified', 'createDate': '2013-05-09 17:42:17', 'updateDate': '2015-12-17 03:24:41', 'glass': {'id': 6, 'name': 'Snifter', 'createDate': '2012-01-03 02:41:33'}, 'available': {'id': 2, 'name': 'Limited', 'description': 'Limited availability.'}, 'style': {'id': 46, 'categoryId': 4, 'category': {'id': 4, 'name': 'German Origin Ales', 'createDate': '2012-03-21 20:06:46'}, 'name': 'Berliner-Style Weisse (Wheat)', 'shortName': 'Berlinerweisse', 'description': 'This is very pale in color and the lightest of all the German wheat beers. The unique combination of yeast and lactic acid bacteria fermentation yields a beer that is acidic, highly attenuated, and very light bodied. The carbonation of a Berliner Weisse is high, and hop rates are very low. Clarity may be hazy or cloudy from yeast or chill haze. Hop character should not be perceived. Fruity esters will be evident. No diacetyl should be perceived.', 'ibuMin': '3', 'ibuMax': '6', 'abvMin': '2.8', 'abvMax': '3.4', 'srmMin': '2', 'srmMax': '4', 'ogMin': '1.028', 'fgMin': '1.004', 'fgMax': '1.006', 'createDate': '2012-03-21 20:06:46', 'updateDate': '2015-04-07 15:29:14'}}",success
43,2,6,273,"{'id': 'MMA4Rp', 'name': 'GFB', 'nameDisplay': 'GFB', 'description': 'GFB our Golden, with the sort of light clean tasty quality which makes an ideal session ale. Tasted to destruction by our brewers, GFB our Golden Best has a hoppy aroma and is packed full of the very best East Kent Goldings, leading to a good dry finish.\r\n\r\nGFB our Golden Best has an ABV of 3.5%\r\n\r\nPlease note: that poly pins are not stock items, but lovingly made to order for you. We need at least 5 working days to produce your order. Thank you for your patience.', 'abv': '3.5', 'styleId': 36, 'isOrganic': 'N', 'labels': {'icon': 'https://s3.amazonaws.com/brewerydbapi/beer/MMA4Rp/upload_sRkZgp-icon.png', 'medium': 'https://s3.amazonaws.com/brewerydbapi/beer/MMA4Rp/upload_sRkZgp-medium.png', 'large': 'https://s3.amazonaws.com/brewerydbapi/beer/MMA4Rp/upload_sRkZgp-large.png'}, 'status': 'verified', 'statusDisplay': 'Verified', 'createDate': '2015-03-04 09:33:57', 'updateDate': '2015-12-17 23:14:31', 'style': {'id': 36, 'categoryId': 3, 'category': {'id': 3, 'name': 'North American Origin Ales', 'createDate': '2012-03-21 20:06:45'}, 'name': 'Golden or Blonde Ale', 'shortName': 'Blonde', 'description': 'Golden or Blonde ales are straw to golden blonde in color. They have a crisp, dry palate, light to medium body, and light malt sweetness. Low to medium hop aroma may be present but does not dominate. Bitterness is low to medium. Fruity esters may be perceived but do not predominate. Diacetyl should not be perceived. Chill haze should be absent.', 'ibuMin': '15', 'ibuMax': '25', 'abvMin': '4', 'abvMax': '5', 'srmMin': '3', 'srmMax': '7', 'ogMin': '1.045', 'fgMin': '1.008', 'fgMax': '1.016', 'createDate': '2012-03-21 20:06:46', 'updateDate': '2015-04-07 15:27:26'}}",success
44,2,6,273,"{'id': 'BojDgE', 'name': 'Globe Premium Gold', 'nameDisplay': 'Globe Premium Gold', 'description': 'A premium mid strength beer with heaps of flavour to enjoy yourself! Full flavoured and great taste.', 'abv': '3.5', 'availableId': 1, 'styleId': 94, 'isOrganic': 'N', 'status': 'verified', 'statusDisplay': 'Verified', 'createDate': '2017-09-13 10:12:13', 'updateDate': '2017-09-13 12:20:52', 'available': {'id': 1, 'name': 'Year Round', 'description': 'Available year round as a staple beer.'}, 'style': {'id': 94, 'categoryId': 8, 'category': {'id': 8, 'name': 'North American Lager', 'createDate': '2012-03-21 20:06:46'}, 'name': 'American-Style Light (Low Calorie) Lager', 'shortName': 'American Light Lager', 'description': 'These beers are extremely light colored, light in body, and high in carbonation. Calorie level should not exceed 125 per 12 ounce serving. Corn, rice, or other grain or sugar adjuncts are often used. Flavor is mild and hop bitterness and aroma is negligible to very low. Light fruity esters are acceptable. Chill haze and diacetyl should be absent.', 'ibuMin': '5', 'ibuMax': '10', 'abvMin': '3.5', 'abvMax': '4.4', 'srmMin': '2', 'srmMax': '4', 'ogMin': '1.024', 'fgMin': '1.002', 'fgMax': '1.008', 'createDate': '2012-03-21 20:06:46', 'updateDate': '2015-04-07 15:39:35'}}",success
45,2,6,273,"{'id': 'Yi5ESY', 'name': 'Go Halfsies', 'nameDisplay': 'Go Halfsies', 'description': 'A Grapefruit Radler', 'abv': '3.5', 'ibu': '17', 'styleId': 119, 'isOrganic': 'N', 'status': 'verified', 'statusDisplay': 'Verified', 'createDate': '2018-08-17 17:38:43', 'updateDate': '2018-08-17 17:38:43', 'style': {'id': 119, 'categoryId': 11, 'category': {'id': 11, 'name': 'Hybrid/mixed Beer', 'createDate': '2012-03-21 20:06:46'}, 'name': 'Fruit Beer', 'shortName': 'Fruit Beer', 'description': 'Fruit beers are any beers using fruit or fruit extracts as an adjunct in either, the mash, kettle, primary or secondary fermentation providing obvious (ranging from subtle to intense), yet harmonious, fruit qualities. Fruit qualities should not be overpowered by hop character. If a fruit (such as juniper berry) has an herbal or spice quality, it is more appropriate to consider it in the herb and spice beers category. Acidic bacterial (not wild yeast) fermentation characters may be evident (but not necessary) they would contribute to acidity and enhance fruity balance. Clear or hazy beer is acceptable in appearance. A statement by the brewer explaining what fruits are used is essential in order for fair assessment in competitions. If this beer is a classic style with fruit, the brewer should also specify the classic style.', 'ibuMin': '5', 'ibuMax': '70', 'abvMin': '2.5', 'abvMax': '12', 'srmMin': '5', 'srmMax': '50', 'ogMin': '1.03', 'fgMin': '1.006', 'fgMax': '1.03', 'createDate': '2012-03-21 20:06:46', 'updateDate': '2015-04-07 15:44:21'}}",success
46,2,6,273,"{'id': 'ZPpBg3', 'name': 'Gold', 'nameDisplay': 'Gold', 'description': 'Balanced smooth flavor and body, complimented by mild bitterness and trace sweetness from extra malt.', 'abv': '3.5', 'styleId': 93, 'isOrganic': 'N', 'status': 'verified', 'statusDisplay': 'Verified', 'createDate': '2013-05-10 18:01:47', 'updateDate': '2013-05-10 18:01:47', 'style': {'id': 93, 'categoryId': 8, 'category': {'id': 8, 'name': 'North American Lager', 'createDate': '2012-03-21 20:06:46'}, 'name': 'American-Style Lager', 'shortName': 'American Lager', 'description': 'Light in body and very light to straw in color, American lagers are very clean and crisp and aggressively carbonated. Flavor components should b e subtle and complex, with no one ingredient dominating the others. Malt sweetness is light to mild. Corn, rice, or other grain or sugar adjuncts are often used. Hop bitterness, flavor and aroma are negligible to very light. Light fruity esters are acceptable. Chill haze and diacetyl should be absent.', 'ibuMin': '5', 'ibuMax': '13', 'abvMin': '3.8', 'abvMax': '5', 'srmMin': '2', 'srmMax': '4', 'ogMin': '1.04', 'fgMin': '1.006', 'fgMax': '1.01', 'createDate': '2012-03-21 20:06:46', 'updateDate': '2015-04-07 15:39:26'}}",success
47,2,6,273,"{'id': 'hNJJ3K', 'name': 'Golden Ale', 'nameDisplay': 'Golden Ale', 'description': 'Bright golden colour with a thick fluffy head and low carbonation.  Bold sweet citrus and stone fruit aromatics with a hint of biscuity malt. The flavour is clean and crisp with a light citrus hop profile and sweet malt. It finishes thin and clean with a mild bitterness.  A nice easy going golden ale with a beautiful aroma and clean flavour to back it up.', 'abv': '3.5', 'ibu': '16', 'styleId': 36, 'isOrganic': 'N', 'status': 'verified', 'statusDisplay': 'Verified', 'createDate': '2018-04-01 07:06:41', 'updateDate': '2018-04-04 17:58:07', 'style': {'id': 36, 'categoryId': 3, 'category': {'id': 3, 'name': 'North American Origin Ales', 'createDate': '2012-03-21 20:06:45'}, 'name': 'Golden or Blonde Ale', 'shortName': 'Blonde', 'description': 'Golden or Blonde ales are straw to golden blonde in color. They have a crisp, dry palate, light to medium body, and light malt sweetness. Low to medium hop aroma may be present but does not dominate. Bitterness is low to medium. Fruity esters may be perceived but do not predominate. Diacetyl should not be perceived. Chill haze should be absent.', 'ibuMin': '15', 'ibuMax': '25', 'abvMin': '4', 'abvMax': '5', 'srmMin': '3', 'srmMax': '7', 'ogMin': '1.045', 'fgMin': '1.008', 'fgMax': '1.016', 'createDate': '2012-03-21 20:06:46', 'updateDate': '2015-04-07 15:27:26'}}",success
48,2,6,273,"{'id': '5KMRtV', 'name': 'Golden Best', 'nameDisplay': 'Golden Best', 'description': 'The last of the true Pennine light milds, this amber coloured beer makes a refreshing session ale. The smooth and creamy flavour made it the popular choice close to the Brewery. Today its popularity is becoming more widespread.', 'abv': '3.5', 'glasswareId': 5, 'styleId': 36, 'isOrganic': 'N', 'status': 'verified', 'statusDisplay': 'Verified', 'createDate': '2013-05-10 12:50:25', 'updateDate': '2013-05-10 12:50:25', 'glass': {'id': 5, 'name': 'Pint', 'createDate': '2012-01-03 02:41:33'}, 'style': {'id': 36, 'categoryId': 3, 'category': {'id': 3, 'name': 'North American Origin Ales', 'createDate': '2012-03-21 20:06:45'}, 'name': 'Golden or Blonde Ale', 'shortName': 'Blonde', 'description': 'Golden or Blonde ales are straw to golden blonde in color. They have a crisp, dry palate, light to medium body, and light malt sweetness. Low to medium hop aroma may be present but does not dominate. Bitterness is low to medium. Fruity esters may be perceived but do not predominate. Diacetyl should not be perceived. Chill haze should be absent.', 'ibuMin': '15', 'ibuMax': '25', 'abvMin': '4', 'abvMax': '5', 'srmMin': '3', 'srmMax': '7', 'ogMin': '1.045', 'fgMin': '1.008', 'fgMax': '1.016', 'createDate': '2012-03-21 20:06:46', 'updateDate': '2015-04-07 15:27:26'}}",success
49,2,6,273,"{'id': 'TYxY3C', 'name': 'GOLDEN LAGER', 'nameDisplay': 'GOLDEN LAGER', 'description': 'Inspired by the European Noble brews, our Golden lager has an aroma of Noble hops and fresh Pilsner malts. Our Golden has a creamy head, brilliant clarity, a flavor that is malty, balanced, and crisp.', 'abv': '3.5', 'ibu': '25', 'srmId': 6, 'availableId': 1, 'styleId': 36, 'isOrganic': 'Y', 'labels': {'icon': 'https://s3.amazonaws.com/brewerydbapi/beer/TYxY3C/upload_KJJmMb-icon.png', 'medium': 'https://s3.amazonaws.com/brewerydbapi/beer/TYxY3C/upload_KJJmMb-medium.png', 'large': 'https://s3.amazonaws.com/brewerydbapi/beer/TYxY3C/upload_KJJmMb-large.png'}, 'status': 'verified', 'statusDisplay': 'Verified', 'originalGravity': '1.044', 'createDate': '2015-05-12 15:33:19', 'updateDate': '2017-08-30 17:28:11', 'srm': {'id': 6, 'name': '6', 'hex': 'F8A600'}, 'available': {'id': 1, 'name': 'Year Round', 'description': 'Available year round as a staple beer.'}, 'style': {'id': 36, 'categoryId': 3, 'category': {'id': 3, 'name': 'North American Origin Ales', 'createDate': '2012-03-21 20:06:45'}, 'name': 'Golden or Blonde Ale', 'shortName': 'Blonde', 'description': 'Golden or Blonde ales are straw to golden blonde in color. They have a crisp, dry palate, light to medium body, and light malt sweetness. Low to medium hop aroma may be present but does not dominate. Bitterness is low to medium. Fruity esters may be perceived but do not predominate. Diacetyl should not be perceived. Chill haze should be absent.', 'ibuMin': '15', 'ibuMax': '25', 'abvMin': '4', 'abvMax': '5', 'srmMin': '3', 'srmMax': '7', 'ogMin': '1.045', 'fgMin': '1.008', 'fgMax': '1.016', 'createDate': '2012-03-21 20:06:46', 'updateDate': '2015-04-07 15:27:26'}}",success
