,currentPage,numberOfPages,totalResults,data,status
0,1,6,273,"{'id': 'Qg6dpg', 'name': '1916 Irish Stout', 'nameDisplay': '1916 Irish Stout', 'abv': '3.5', 'styleId': 42, 'isOrganic': 'N', 'status': 'verified', 'statusDisplay': 'Verified', 'createDate': '2012-01-03 02:42:37', 'updateDate': '2015-05-22 15:22:58', 'style': {'id': 42, 'categoryId': 3, 'category': {'id': 3, 'name': 'North American Origin Ales', 'createDate': '2012-03-21 20:06:45'}, 'name': 'American-Style Stout', 'shortName': 'American Stout', 'description': 'Initial low to medium malt sweetness with a degree of caramel, chocolate and/or roasted coffee flavor with a distinctive dryroasted bitterness in the finish. Coffee-like roasted barley and roasted malt aromas are prominent. Some slight roasted malt acidity is permissible and a medium- to full-bodied mouthfeel is appropriate. Hop bitterness may be moderate to high. Hop aroma and flavor is moderate to high, often with American citrus-type and/or resiny hop character. The perception of fruity esters is low. Roasted malt/barley astringency may be low but not excessive. Diacetyl (butterscotch) should be negligible or not perceived. Head retention is excellent.', 'ibuMin': '35', 'ibuMax': '60', 'abvMin': '5.7', 'abvMax': '8.8', 'srmMin': '40', 'srmMax': '40', 'ogMin': '1.05', 'fgMin': '1.01', 'fgMax': '1.022', 'createDate': '2012-03-21 20:06:46', 'updateDate': '2015-04-07 15:28:43'}}",success
1,1,6,273,"{'id': 'gQrXfL', 'name': 'Alby Crisp Lager', 'nameDisplay': 'Alby Crisp Lager', 'description': 'Alby Crisp is an easy drinking contemporary lager. It\'s light body and mild bitterness make it super refreshing any time of the year. In 1837, the Albion Brewery poured WA\'s first beer. More than 175 years later, they bring you the ""new"" Albion and Alby: locally brewed using 100% WA grown barley.', 'abv': '3.5', 'styleId': 93, 'isOrganic': 'N', 'status': 'verified', 'statusDisplay': 'Verified', 'createDate': '2018-05-05 04:17:40', 'updateDate': '2018-05-14 20:21:59', 'style': {'id': 93, 'categoryId': 8, 'category': {'id': 8, 'name': 'North American Lager', 'createDate': '2012-03-21 20:06:46'}, 'name': 'American-Style Lager', 'shortName': 'American Lager', 'description': 'Light in body and very light to straw in color, American lagers are very clean and crisp and aggressively carbonated. Flavor components should b e subtle and complex, with no one ingredient dominating the others. Malt sweetness is light to mild. Corn, rice, or other grain or sugar adjuncts are often used. Hop bitterness, flavor and aroma are negligible to very light. Light fruity esters are acceptable. Chill haze and diacetyl should be absent.', 'ibuMin': '5', 'ibuMax': '13', 'abvMin': '3.8', 'abvMax': '5', 'srmMin': '2', 'srmMax': '4', 'ogMin': '1.04', 'fgMin': '1.006', 'fgMax': '1.01', 'createDate': '2012-03-21 20:06:46', 'updateDate': '2015-04-07 15:39:26'}}",success
2,1,6,273,"{'id': 'JaLg23', 'name': 'Ale Terrain XVI', 'nameDisplay': 'Ale Terrain XVI', 'abv': '3.5', 'styleId': 11, 'isOrganic': 'N', 'status': 'verified', 'statusDisplay': 'Verified', 'createDate': '2018-05-10 20:24:25', 'updateDate': '2018-05-24 19:06:51', 'style': {'id': 11, 'categoryId': 1, 'category': {'id': 1, 'name': 'British Origin Ales', 'createDate': '2012-03-21 20:06:45'}, 'name': 'English-Style Dark Mild Ale', 'shortName': 'English Dark Mild', 'description': 'English dark mild ales range from deep copper to dark brown (often with a red tint) in color. Malt flavor and caramel are part of the flavor and aroma profile while, licorice and roast malt tones may sometimes contribute to the flavor and aroma profile. Body should be low-medium to medium. These beers have very little hop flavor or aroma. Very low diacetyl flavors may be appropriate in this low-alcohol beer. Fruity-ester level is very low.', 'ibuMin': '10', 'ibuMax': '24', 'abvMin': '3.2', 'abvMax': '4', 'srmMin': '17', 'srmMax': '34', 'ogMin': '1.03', 'fgMin': '1.004', 'fgMax': '1.008', 'createDate': '2012-03-21 20:06:45', 'updateDate': '2015-04-07 15:20:43'}}",success
3,1,6,273,"{'id': 'BiZ8dS', 'name': 'All Growed Up Root Beer', 'nameDisplay': 'All Growed Up Root Beer', 'description': 'Brewed adult root beer. Not for kids!\r\n\r\nThis is actually a beer, not a cocktail with liquors mixed in.', 'abv': '3.5', 'styleId': 125, 'isOrganic': 'N', 'status': 'verified', 'statusDisplay': 'Verified', 'createDate': '2015-04-10 18:18:42', 'updateDate': '2015-04-10 18:18:42', 'style': {'id': 125, 'categoryId': 11, 'category': {'id': 11, 'name': 'Hybrid/mixed Beer', 'createDate': '2012-03-21 20:06:46'}, 'name': 'Specialty Beer', 'shortName': 'Specialty', 'description': 'These beers are brewed using unusual fermentable sugars, grains and starches that contribute to alcohol content other than, or in addition to, malted barley. Nuts generally have some degree of fermentables, thus beers brewed with nuts would appropriately be entered in this category. The distinctive characters of these special ingredients should be evident either in the aroma, flavor or overall balance of the beer, but not necessarily in overpowering quantities. For example, maple syrup or potatoes would be considered unusual. Rice, corn, or wheat are not considered unusual. Special ingredients must be listed when competing. A statement by the brewer explaining the special nature of the beer, ingredient(s) and achieved character is essential in order for fair assessment in competitions. If this beer is a classic style with some specialty ingredient(s), the brewer should also specify the classic style. Guidelines for competing: Spiced beers using unusual fermentables should be entered in the experimental category. Fruit beers using unusual fermentables should be entered in the fruit beer category.', 'ibuMax': '100', 'abvMin': '2.5', 'abvMax': '25', 'srmMin': '1', 'srmMax': '100', 'ogMin': '1.03', 'fgMin': '1.006', 'fgMax': '1.03', 'createDate': '2012-03-21 20:06:46', 'updateDate': '2015-04-07 15:44:53'}}",success
4,1,6,273,"{'id': 'VOUZYC', 'name': 'Amarillo Mild', 'nameDisplay': 'Amarillo Mild', 'abv': '3.5', 'styleId': 10, 'isOrganic': 'N', 'status': 'verified', 'statusDisplay': 'Verified', 'createDate': '2016-05-17 20:18:24', 'updateDate': '2016-05-17 20:18:24', 'style': {'id': 10, 'categoryId': 1, 'category': {'id': 1, 'name': 'British Origin Ales', 'createDate': '2012-03-21 20:06:45'}, 'name': 'English-Style Pale Mild Ale', 'shortName': 'English Pale Mild', 'description': 'English pale mild ales range from golden to amber in color. Malt flavor dominates the flavor profile with little hop bitterness or flavor. Hop aroma can be light. Very low diacetyl flavors may be appropriate in this low-alcohol beer. Fruity-ester level is very low. Chill haze is allowable at cold temperatures.', 'ibuMin': '10', 'ibuMax': '20', 'abvMin': '3.2', 'abvMax': '4', 'srmMin': '8', 'srmMax': '17', 'ogMin': '1.03', 'fgMin': '1.004', 'fgMax': '1.008', 'createDate': '2012-03-21 20:06:45', 'updateDate': '2015-04-07 15:20:35'}}",success
5,1,6,273,"{'id': 'NJl5V3', 'name': 'American Expedition Honey Ginger Wheat Ale Shandy', 'nameDisplay': 'American Expedition Honey Ginger Wheat Ale Shandy', 'abv': '3.5', 'styleId': 25, 'isOrganic': 'N', 'status': 'verified', 'statusDisplay': 'Verified', 'createDate': '2017-07-18 06:41:36', 'updateDate': '2017-07-18 14:19:05', 'style': {'id': 25, 'categoryId': 3, 'category': {'id': 3, 'name': 'North American Origin Ales', 'createDate': '2012-03-21 20:06:45'}, 'name': 'American-Style Pale Ale', 'shortName': 'American Pale', 'description': 'American pale ales range from deep golden to copper in color. The style is characterized by fruity, floral and citrus-like American-variety hop character producing medium to medium-high hop bitterness, flavor, and aroma. Note that the ""traditional"" style of this beer has its origins with certain floral, fruity, citrus-like, piney, resinous, or sulfur-like American hop varietals. One or more of these hop characters is the perceived end, but the perceived hop characters may be a result of the skillful use of hops of other national origins. American pale ales have medium body and low to medium maltiness. Low caramel character is allowable. Fruity-ester flavor and aroma should be moderate to strong. Diacetyl should be absent or present at very low levels. Chill haze is allowable at cold temperatures.', 'ibuMin': '30', 'ibuMax': '42', 'abvMin': '4.5', 'abvMax': '5.6', 'srmMin': '6', 'srmMax': '14', 'ogMin': '1.044', 'fgMin': '1.008', 'fgMax': '1.014', 'createDate': '2012-03-21 20:06:45', 'updateDate': '2015-04-07 15:25:18'}}",success
6,1,6,273,"{'id': 'NrPWte', 'name': 'American Pale Ale', 'nameDisplay': 'American Pale Ale', 'description': 'Our American Pale Ale is based on the American West Coast pale ale. This style makes use of American hops to give it its unique, upfront aromas. Refreshing and full flavoured, yet light in alcohol and body, Devil’s Peak American Pale Ale is intended to be enjoyed as a session ale.', 'abv': '3.5', 'ibu': '23', 'styleId': 25, 'isOrganic': 'N', 'status': 'verified', 'statusDisplay': 'Verified', 'originalGravity': '1.039', 'createDate': '2016-05-11 16:23:14', 'updateDate': '2016-05-11 16:23:14', 'style': {'id': 25, 'categoryId': 3, 'category': {'id': 3, 'name': 'North American Origin Ales', 'createDate': '2012-03-21 20:06:45'}, 'name': 'American-Style Pale Ale', 'shortName': 'American Pale', 'description': 'American pale ales range from deep golden to copper in color. The style is characterized by fruity, floral and citrus-like American-variety hop character producing medium to medium-high hop bitterness, flavor, and aroma. Note that the ""traditional"" style of this beer has its origins with certain floral, fruity, citrus-like, piney, resinous, or sulfur-like American hop varietals. One or more of these hop characters is the perceived end, but the perceived hop characters may be a result of the skillful use of hops of other national origins. American pale ales have medium body and low to medium maltiness. Low caramel character is allowable. Fruity-ester flavor and aroma should be moderate to strong. Diacetyl should be absent or present at very low levels. Chill haze is allowable at cold temperatures.', 'ibuMin': '30', 'ibuMax': '42', 'abvMin': '4.5', 'abvMax': '5.6', 'srmMin': '6', 'srmMax': '14', 'ogMin': '1.044', 'fgMin': '1.008', 'fgMax': '1.014', 'createDate': '2012-03-21 20:06:45', 'updateDate': '2015-04-07 15:25:18'}}",success
7,1,6,273,"{'id': 'UWtF4X', 'name': 'Amstel Light', 'nameDisplay': 'Amstel Light', 'description': 'A special light beer containing only 3.5% alcohol and approximately 35% fewer calories than regular lager beer. But every bit as thirst-quenching and refreshing.', 'abv': '3.5', 'glasswareId': 4, 'availableId': 1, 'styleId': 94, 'isOrganic': 'N', 'labels': {'icon': 'https://s3.amazonaws.com/brewerydbapi/beer/UWtF4X/upload_XwWZw0-icon.png', 'medium': 'https://s3.amazonaws.com/brewerydbapi/beer/UWtF4X/upload_XwWZw0-medium.png', 'large': 'https://s3.amazonaws.com/brewerydbapi/beer/UWtF4X/upload_XwWZw0-large.png'}, 'status': 'verified', 'statusDisplay': 'Verified', 'servingTemperature': 'cold', 'servingTemperatureDisplay': 'Cold - (4-7C/39-45F)', 'createDate': '2012-01-03 02:42:42', 'updateDate': '2018-08-03 19:02:19', 'glass': {'id': 4, 'name': 'Pilsner', 'createDate': '2012-01-03 02:41:33'}, 'available': {'id': 1, 'name': 'Year Round', 'description': 'Available year round as a staple beer.'}, 'style': {'id': 94, 'categoryId': 8, 'category': {'id': 8, 'name': 'North American Lager', 'createDate': '2012-03-21 20:06:46'}, 'name': 'American-Style Light (Low Calorie) Lager', 'shortName': 'American Light Lager', 'description': 'These beers are extremely light colored, light in body, and high in carbonation. Calorie level should not exceed 125 per 12 ounce serving. Corn, rice, or other grain or sugar adjuncts are often used. Flavor is mild and hop bitterness and aroma is negligible to very low. Light fruity esters are acceptable. Chill haze and diacetyl should be absent.', 'ibuMin': '5', 'ibuMax': '10', 'abvMin': '3.5', 'abvMax': '4.4', 'srmMin': '2', 'srmMax': '4', 'ogMin': '1.024', 'fgMin': '1.002', 'fgMax': '1.008', 'createDate': '2012-03-21 20:06:46', 'updateDate': '2015-04-07 15:39:35'}}",success
8,1,6,273,"{'id': 'As73p2', 'name': 'Anniversary Ale', 'nameDisplay': 'Anniversary Ale', 'description': 'This special ale is a hybrid of styles: a dark beer, a Belgian beer and a session beer. Black in color, with a light to medium body and smooth mouthfeel. Our Anniversary Beer starts out crisp with just the right amount of malt and a hint of pepper, finishing clean w/just a hint of Belgian esters. At 3.5% you will be able to enjoy more than one of these!', 'abv': '3.5', 'ibu': '20', 'glasswareId': 5, 'availableId': 2, 'styleId': 125, 'isOrganic': 'N', 'status': 'verified', 'statusDisplay': 'Verified', 'createDate': '2013-05-05 13:42:51', 'updateDate': '2013-05-05 13:42:51', 'glass': {'id': 5, 'name': 'Pint', 'createDate': '2012-01-03 02:41:33'}, 'available': {'id': 2, 'name': 'Limited', 'description': 'Limited availability.'}, 'style': {'id': 125, 'categoryId': 11, 'category': {'id': 11, 'name': 'Hybrid/mixed Beer', 'createDate': '2012-03-21 20:06:46'}, 'name': 'Specialty Beer', 'shortName': 'Specialty', 'description': 'These beers are brewed using unusual fermentable sugars, grains and starches that contribute to alcohol content other than, or in addition to, malted barley. Nuts generally have some degree of fermentables, thus beers brewed with nuts would appropriately be entered in this category. The distinctive characters of these special ingredients should be evident either in the aroma, flavor or overall balance of the beer, but not necessarily in overpowering quantities. For example, maple syrup or potatoes would be considered unusual. Rice, corn, or wheat are not considered unusual. Special ingredients must be listed when competing. A statement by the brewer explaining the special nature of the beer, ingredient(s) and achieved character is essential in order for fair assessment in competitions. If this beer is a classic style with some specialty ingredient(s), the brewer should also specify the classic style. Guidelines for competing: Spiced beers using unusual fermentables should be entered in the experimental category. Fruit beers using unusual fermentables should be entered in the fruit beer category.', 'ibuMax': '100', 'abvMin': '2.5', 'abvMax': '25', 'srmMin': '1', 'srmMax': '100', 'ogMin': '1.03', 'fgMin': '1.006', 'fgMax': '1.03', 'createDate': '2012-03-21 20:06:46', 'updateDate': '2015-04-07 15:44:53'}}",success
9,1,6,273,"{'id': 'uibWLW', 'name': 'Atlas Golden Light', 'nameDisplay': 'Atlas Golden Light', 'description': 'Atlas Golden Light a Pale Lager beer by Cerveceria Nacional Panama (SABMiller), a brewery in Panama.', 'abv': '3.5', 'styleId': 94, 'isOrganic': 'N', 'status': 'verified', 'statusDisplay': 'Verified', 'createDate': '2018-02-25 18:20:44', 'updateDate': '2018-02-27 17:24:43', 'style': {'id': 94, 'categoryId': 8, 'category': {'id': 8, 'name': 'North American Lager', 'createDate': '2012-03-21 20:06:46'}, 'name': 'American-Style Light (Low Calorie) Lager', 'shortName': 'American Light Lager', 'description': 'These beers are extremely light colored, light in body, and high in carbonation. Calorie level should not exceed 125 per 12 ounce serving. Corn, rice, or other grain or sugar adjuncts are often used. Flavor is mild and hop bitterness and aroma is negligible to very low. Light fruity esters are acceptable. Chill haze and diacetyl should be absent.', 'ibuMin': '5', 'ibuMax': '10', 'abvMin': '3.5', 'abvMax': '4.4', 'srmMin': '2', 'srmMax': '4', 'ogMin': '1.024', 'fgMin': '1.002', 'fgMax': '1.008', 'createDate': '2012-03-21 20:06:46', 'updateDate': '2015-04-07 15:39:35'}}",success
10,1,6,273,"{'id': 'p4Q0Sw', 'name': 'Avril', 'nameDisplay': 'Avril', 'description': 'Bières de table are not the heavy hitters Belgium is so famous for – but are central to Belgian beer culture because they are how Belgians learn to appreciate beer. They are typically enjoyed with home cooked meals at the family dining table. There is no finer example of the style than Avril. USDA-certified, organic Avril is aromatic like fresh bread, full in the mouth and light on the finish. Exceptionally flavorful given its low 3.5% alcohol by volume.', 'abv': '3.5', 'styleId': 72, 'isOrganic': 'N', 'labels': {'icon': 'https://s3.amazonaws.com/brewerydbapi/beer/p4Q0Sw/upload_tLhdCQ-icon.png', 'medium': 'https://s3.amazonaws.com/brewerydbapi/beer/p4Q0Sw/upload_tLhdCQ-medium.png', 'large': 'https://s3.amazonaws.com/brewerydbapi/beer/p4Q0Sw/upload_tLhdCQ-large.png'}, 'status': 'verified', 'statusDisplay': 'Verified', 'createDate': '2017-09-18 20:00:47', 'updateDate': '2017-09-18 20:01:04', 'style': {'id': 72, 'categoryId': 5, 'category': {'id': 5, 'name': 'Belgian And French Origin Ales', 'createDate': '2012-03-21 20:06:46'}, 'name': 'French & Belgian-Style Saison', 'shortName': 'Saison', 'description': 'Beers in this category are golden to deep amber in color. There may be quite a variety of characters within this style. Generally: They are light to medium in body. Malt aroma is low to medium-low. Esters are medium to high in  aroma, while, complex alcohols, herbs, spices, low Brettanomyces character and even clove and smoke-like phenolics may or may not be evident in the overall balanced beer. Hop aroma and flavor may be at low to medium levels. Malt flavor is low but provides foundation for the overall balance. Hop bitterness is moderate to moderately assertive. Herb and/or spice flavors, including black pepper-like notes, may or may not be evident. Fruitiness from fermentation is generally in character. A balanced small amount of sour or acidic flavors is acceptable when in balance with other components. Earthy, cellar-like, musty aromas are okay. Diacetyl should not be perceived. Chill or slight yeast haze is okay. Often bottle conditioned with some yeast character and high carbonation. French & Belgian-Style Saison may have Brettanomyces characters that are slightly acidity, fruity, horsey, goaty and/or leather-like.', 'ibuMin': '20', 'ibuMax': '40', 'abvMin': '4.5', 'abvMax': '8.5', 'srmMin': '4', 'srmMax': '14', 'ogMin': '1.055', 'fgMin': '1.004', 'fgMax': '1.016', 'createDate': '2012-03-21 20:06:46', 'updateDate': '2015-04-07 15:34:55'}}",success
11,1,6,273,"{'id': 'lPLxSw', 'name': 'B. Weisse', 'nameDisplay': 'B. Weisse', 'description': 'B.Weisse, or Berliner Weisse is a sour, German wheat beer perfect for the summer. B.Weisse is made with a blend of white & red wheat that takes up 50% of the grain bill and is fermented with a blend of house yeast and lactobacillus. The Lacto gives this wheat beers its tart and acidic refreshing qualities, where the wheat malt lends the round malt body. Hints of pineapple and lemon abound in the effervescence of the nose. The refreshing flavor of this beer makes it the best option for a warm day!', 'abv': '3.5', 'ibu': '6.1', 'glasswareId': 4, 'availableId': 6, 'styleId': 46, 'isOrganic': 'N', 'labels': {'icon': 'https://s3.amazonaws.com/brewerydbapi/beer/lPLxSw/upload_XLqXqv-icon.png', 'medium': 'https://s3.amazonaws.com/brewerydbapi/beer/lPLxSw/upload_XLqXqv-medium.png', 'large': 'https://s3.amazonaws.com/brewerydbapi/beer/lPLxSw/upload_XLqXqv-large.png'}, 'status': 'verified', 'statusDisplay': 'Verified', 'servingTemperature': 'very_cold', 'servingTemperatureDisplay': 'Very Cold - (0-4C/32-39F)', 'createDate': '2015-06-19 21:22:49', 'updateDate': '2015-12-18 03:52:33', 'glass': {'id': 4, 'name': 'Pilsner', 'createDate': '2012-01-03 02:41:33'}, 'available': {'id': 6, 'name': 'Summer', 'description': 'Available during the summer months.'}, 'style': {'id': 46, 'categoryId': 4, 'category': {'id': 4, 'name': 'German Origin Ales', 'createDate': '2012-03-21 20:06:46'}, 'name': 'Berliner-Style Weisse (Wheat)', 'shortName': 'Berlinerweisse', 'description': 'This is very pale in color and the lightest of all the German wheat beers. The unique combination of yeast and lactic acid bacteria fermentation yields a beer that is acidic, highly attenuated, and very light bodied. The carbonation of a Berliner Weisse is high, and hop rates are very low. Clarity may be hazy or cloudy from yeast or chill haze. Hop character should not be perceived. Fruity esters will be evident. No diacetyl should be perceived.', 'ibuMin': '3', 'ibuMax': '6', 'abvMin': '2.8', 'abvMax': '3.4', 'srmMin': '2', 'srmMax': '4', 'ogMin': '1.028', 'fgMin': '1.004', 'fgMax': '1.006', 'createDate': '2012-03-21 20:06:46', 'updateDate': '2015-04-07 15:29:14'}}",success
12,1,6,273,"{'id': 'eVNOy0', 'name': 'Babalu', 'nameDisplay': 'Babalu', 'abv': '3.5', 'ibu': '5', 'styleId': 46, 'isOrganic': 'N', 'status': 'verified', 'statusDisplay': 'Verified', 'createDate': '2016-07-25 12:51:23', 'updateDate': '2016-07-25 12:51:23', 'style': {'id': 46, 'categoryId': 4, 'category': {'id': 4, 'name': 'German Origin Ales', 'createDate': '2012-03-21 20:06:46'}, 'name': 'Berliner-Style Weisse (Wheat)', 'shortName': 'Berlinerweisse', 'description': 'This is very pale in color and the lightest of all the German wheat beers. The unique combination of yeast and lactic acid bacteria fermentation yields a beer that is acidic, highly attenuated, and very light bodied. The carbonation of a Berliner Weisse is high, and hop rates are very low. Clarity may be hazy or cloudy from yeast or chill haze. Hop character should not be perceived. Fruity esters will be evident. No diacetyl should be perceived.', 'ibuMin': '3', 'ibuMax': '6', 'abvMin': '2.8', 'abvMax': '3.4', 'srmMin': '2', 'srmMax': '4', 'ogMin': '1.028', 'fgMin': '1.004', 'fgMax': '1.006', 'createDate': '2012-03-21 20:06:46', 'updateDate': '2015-04-07 15:29:14'}}",success
13,1,6,273,"{'id': 'hs8szV', 'name': 'Ballantrae', 'nameDisplay': 'Ballantrae', 'description': 'A light, sweet, traditional light Scottish ale, made with floor-malted British malt, a titch of Caramel malt, a touch of roasted barley, and the barest wisp of smoked malt along with traditional British hops, and Scottish ale yeast. An easy-drinking light dark beer for winter that pairs excellently with shortbread, mild sausage, and woody cheddars.', 'abv': '3.5', 'ibu': '10', 'styleId': 7, 'isOrganic': 'N', 'status': 'verified', 'statusDisplay': 'Verified', 'originalGravity': '1.038', 'createDate': '2014-10-21 19:32:47', 'updateDate': '2014-10-21 20:42:12', 'style': {'id': 7, 'categoryId': 1, 'category': {'id': 1, 'name': 'British Origin Ales', 'createDate': '2012-03-21 20:06:45'}, 'name': 'Scottish-Style Light Ale', 'shortName': 'Scottish Light', 'description': 'Scottish light ales are light bodied. Little bitterness is perceived, and hop flavor or aroma should not be perceived. Despite its lightness, Scottish light ale will have a degree of malty, caramel-like, soft and chewy character. Yeast characters such as diacetyl (butterscotch) and sulfuriness are acceptable at very low levels. The color will range from golden amber to deep brown Bottled versions of this traditional draft beer may contain higher amounts of carbon dioxide than is typical for mildly carbonated draft versions. Chill haze is acceptable at low temperatures. Though there is little evidence suggesting that traditionally made Scottishstyle light ales exhibited peat smoke character, the current marketplace offers many Scottish-style light ales with peat or smoke character present at low to medium levels. Thus a peaty/smoky character may be evident at low levels (ales with medium or higher smoke character would be considered a smoke flavored beer and considered in another category). Scottish-style light ales may be split into two subcategories: Traditional (no smoke character) and Peated (low level of peat smoke character).', 'ibuMin': '9', 'ibuMax': '20', 'abvMin': '2.8', 'abvMax': '3.5', 'srmMin': '8', 'srmMax': '17', 'ogMin': '1.03', 'fgMin': '1.006', 'fgMax': '1.012', 'createDate': '2012-03-21 20:06:45', 'updateDate': '2015-04-07 15:19:41'}}",success
14,1,6,273,"{'id': 'ua6Mb2', 'name': ""Banks's Mild"", 'nameDisplay': ""Banks's Mild"", 'description': ""The original Banks's brew. This is the beer that made Banks's famous and is still the world's best selling mild - it's beautifully balanced, smooth and very moreish.\r\n\r\nA light chestnut coloured beer, exhibiting a glorious balance. Malty with a perceptible burnt note, it's full bodied with a hint of bitterness counterbalancing the rich, biscuity flavour from the best barley.\r\n\r\nThe perfect accompaniment to a spicy Indian dish or strong flavoured meats and game."", 'abv': '3.5', 'glasswareId': 5, 'availableId': 1, 'styleId': 10, 'isOrganic': 'N', 'status': 'verified', 'statusDisplay': 'Verified', 'createDate': '2012-07-12 13:24:51', 'updateDate': '2012-07-12 13:24:51', 'glass': {'id': 5, 'name': 'Pint', 'createDate': '2012-01-03 02:41:33'}, 'available': {'id': 1, 'name': 'Year Round', 'description': 'Available year round as a staple beer.'}, 'style': {'id': 10, 'categoryId': 1, 'category': {'id': 1, 'name': 'British Origin Ales', 'createDate': '2012-03-21 20:06:45'}, 'name': 'English-Style Pale Mild Ale', 'shortName': 'English Pale Mild', 'description': 'English pale mild ales range from golden to amber in color. Malt flavor dominates the flavor profile with little hop bitterness or flavor. Hop aroma can be light. Very low diacetyl flavors may be appropriate in this low-alcohol beer. Fruity-ester level is very low. Chill haze is allowable at cold temperatures.', 'ibuMin': '10', 'ibuMax': '20', 'abvMin': '3.2', 'abvMax': '4', 'srmMin': '8', 'srmMax': '17', 'ogMin': '1.03', 'fgMin': '1.004', 'fgMax': '1.008', 'createDate': '2012-03-21 20:06:45', 'updateDate': '2015-04-07 15:20:35'}}",success
